Category,ProcessedText,SpeakerDialect
درامي,وعلى التجربة اللي انا مريت بيها,Egyptian
كوميدي,بتحصل في اول يوم تصوير,Egyptian
كوميدي,الي خلف ماماتش تسلم دماغي,Egyptian
كوميدي,اصل حضرتك اللي لبستني فكرة لما قلتيلي ان الشرطة هنا صعبة وشديدة جدا وبالعلامة عملتيلي كده,Egyptian
كوميدي,مش كدا ولا ايه,Egyptian
درامي,نتمنى لكم وقت ممتع في السجن,Egyptian
كوميدي,مير ليه مستعجل ولا احنا مش قد المقام ازاي بقى,Egyptian
درامي,بعد ما قلتي له وقالش,Egyptian
درامي,انا لا شوفتك,Egyptian
درامي,برضه لا انت بتشخر وانت نايم,Egyptian
درامي,مع السلامه,Egyptian
درامي,وهي الامومة,Egyptian
درامي,هو بس كان بيلمح تلميحات بسيطة كده ما قليش حاجة وضحه وده من حقه على فكرة هو بني ادم يعني وانا هديته يعني خلاص هو ان شاء الله مش هيكلمك في اي حاجة انا بس اقول لك لو يا سيدي لو,Egyptian
درامي,جبتها منين دي,Egyptian
درامي,ادينا مستنين بقى جايز حد منهم يظهر ونعرف نتصرف,Egyptian
درامي,شوف الناس دول ايه ظروفهم بقي ممكن يعملوا فيه ايه,Egyptian
كوميدي,نتصل بي بقى ولا ايه ده هو اللي بتصل سبحان الله الطيب عند ذكره,Egyptian
اطفال,الايام دول ومين عارف,Egyptian
درامي,لو انت عايزها حجيبهالك,Egyptian
كوميدي,ما فيش مشكلة ابدا انا بره اللعبه,Egyptian
كوميدي,لا يا استاذ ما تخافش ما تخافش يا استاذ كل الدراسات والاتفاقيات والحمد لله تمت والاقمار الصناعية تمت كمان وان شاء الله كلها ايام قليلة وحنبدا ببث قناة مرمر يا استاذ,Egyptian
درامي,فوت نفسي وفوتك معايا بداهية,Egyptian
كوميدي,ابو دخيل,Egyptian
درامي,ونعم بالله,Egyptian
كوميدي,الحقيقة انتوا وشكوا مش غريب عليا انا كنت بتكلم عن استاذ يوسف شعبان الممثل عشان اصحيه عشان رايحين انا بيشتغل معايا,Egyptian
درامي,فهمته يافندم مش عايز يقتنع عايز يقابل حضرتك,Egyptian
كوميدي,ما توسع في الموضوع كل المكاتب اللي حوالينا شغالين في الموضوع ده وبيطلعوا مصاريفهم برضو من القضايا دي نعمل ايه اكل عيش,Egyptian
درامي,والنعمة بالله,Egyptian
درامي,طلع حبيبك مش شاري عيسى ايوا جاية,Egyptian
درامي,يا رب الحمار يكون فهم,Egyptian
درامي,اي خدمة اقوم بيها,Egyptian
كوميدي,فعل الخير,Egyptian
درامي,محتاجين مرتبك,Egyptian
درامي,لا تاخذين في بالك يانجوى لا تاخذي في بالك,Egyptian
درامي,بس دي شكلها داخله وعارفه هي بتعمل كويس قوي,Egyptian
كوميدي,قولهم يا حمد وريحهم,Egyptian
درامي,انت سايب وراك راجل,Egyptian
كوميدي,لا عاش ولا كان لا عاش ولا كان اللي حيقولك كده يا عم طرزان استهدي بالله احنا عايزينك تروح للقاضي وتقولوا ال اللي حصلك عشان كده انت حتخسر كل حاجة,Egyptian
كوميدي,اذا لك,Egyptian
كوميدي,الثقة موجودة,Egyptian
درامي,عشان كذه بقى انا قررت اني انا اسمع كلامك في كل حاجة,Egyptian
كوميدي,مع السلامة يا جو,Egyptian
كوميدي,اه لا مش دا,Egyptian
درامي,معلش يا سيدي دلق القهوة خير,Egyptian
كوميدي,يا ابني الله يهديك ادخل غير هدومك احنا اتاخرنا على الجماعة,Egyptian
كوميدي,ايه تقول,Egyptian
درامي,حرق الكرت هذا,Egyptian
درامي,ما ابي موضوع اخوك تعطل مصالحنا,Egyptian
درامي,ما تعرفش اديه انا فرحت لما شوفت الفيديو بتاعك,Egyptian
اطفال,حط الشاي عدل يا عم,Egyptian
درامي,تعبت يا مسكين,Egyptian
اطفال,واد يا سكرور,Egyptian
درامي,طيب يا سيدي,Egyptian
اطفال,حب الارض شي جوانا,Egyptian
كوميدي,السع لوة السعلوة,Egyptian
درامي,ما حصلش كده يا استاذ خالد دي بتفتري عليا,Egyptian
اطفال,معلمة صموره,Egyptian
كوميدي,تصبحوا على خير,Egyptian
كوميدي,حس بمشاكلكم,Egyptian
درامي,على الاقل ما يلفتش الانظار عاملين حسابنا بس باكد عليك لازم انت و مدام حبيبة تلفوناتكم تكون دائما تبقى مقفولة بس ليه ده احنا معانا خطوط جديدة ممكن اي حد باي وسيلة تكنولوجية يقدر يوصل الارقام الجديدة بتاعتك طبعا لو حبيت تعمل مكالمة لازم تبعد عن المكان اللي في الشحنة عشان ما حدش يقدر يوصلنا لا دي احنا عارفينها بعدين يلا بقى عشان حبيبة تعبانة في العربية بنجر عن طريق من الصبح يلا بينا,Egyptian
درامي,انا بعرف اقراالي في عينيكي من غير ما تتكلمي لا انا اعرف اقرا العنين او ان ما قريت اصابع جديدة علي هاهاها,Egyptian
كوميدي,لا لا ياخويا لاءا عالخط بئى وزي الكورة بالزبط هي الكورة لما تيجي على الخط بتبئى اوت,Egyptian
كوميدي,بناء على الحاح اخويا يوسف,Egyptian
كوميدي,انا طول عمري كنت حاسس اني غريب وانا بعيد عنكم,Egyptian
كوميدي,البسه في المناسبات,Egyptian
اطفال,المتهم يا كبير العسس,Egyptian
درامي,ربنا يعوض عليك,Egyptian
درامي,بالمنطق كده,Egyptian
درامي,الاقي نفسي بكره,Egyptian
درامي,يا اهلا وسهلا يا اهلا وسهلا تفضل يا جماعة,Egyptian
درامي,ما يقدر يجاوب عليه غير واحد من اتنين,Egyptian
درامي,غير كده انا ما عنديش كلام وبشوقك وبراحتك بقى اللي انت عايزه اعمله,Egyptian
درامي,ما هو هذا اللي مجنني هذا اللي مجنني,Egyptian
درامي,الحالة وصلت شركة الشحن خلاص,Egyptian
درامي,فلما طلعت جدع و رجولة مع حد ولازم تكمل الجدعنه للاخر,Egyptian
كوميدي,ما تهدي نفسك شوية وتفتش هنا ولا هنا,Egyptian
درامي,عذرا كي هي شوية انه زهرة البلد تذبل في المكان العدمان ده,Egyptian
كوميدي,اخره نور انا اما اشتغل محدش اطلاقا يتدخل في شغلي اه وانا اللي حمسك الانتاج والاخراج يعني حبقى مسؤول عن الانتاج وانا المخرج طبعا دي حاجة الحاجة التانية انا لما اسخن ببقى نار ما تعرفنيش في البدن بولع,Egyptian
كوميدي,جالك كلامي خلاص الواد مشي حلال عليك العشر تلاف ريال كلهم بس بالله عليك انا عايز نصيبي متنسنيش,Egyptian
درامي,اتفضل يا حبيبي جبت لك النظاره الثانيه من البيت,Egyptian
درامي,لا تحكي للخليل اهم اي شي انت تعرفي صحتها على قدها وما رح تحمل هيك اخبار,Egyptian
درامي,مع السلامة,Egyptian
درامي,,Egyptian
اطفال,طيب طيب يا دكتور شديد طيب,Egyptian
درامي,فلاشه ي,Egyptian
درامي,فهمني الاول مين اللي عايزك وعايزك ليه وعلاشان ايه,Egyptian
كوميدي,في الوقت ده الدش زي الفل,Egyptian
اطفال,اي خدمة,Egyptian
كوميدي,خير المخرج عاوزك بسرعة,Egyptian
كوميدي,هطلع اجيبه من فوق عشان هنمشي على طول علشان عندنا تصوير دلوقتي بس الحقيقة انا اما شفتكوا مش عارف بيتهيا لي شفتكوا قبل كده فين انتوا ما مثلتوش قبل كده,Egyptian
درامي,سكته حضراء,Egyptian
كوميدي,انت بتهزر هنا ولا ايه وش ذا بيديك مدرس رياضيات مثلا لا يا خوي,Egyptian
كوميدي,ابو ابراهيم الحقني يا ابو ابراهيم الله يرحم ابوك الحقني,Egyptian
كوميدي,الشخص اللي هيا تبيه اهلا اهلا منورنا يا اهلا و,Egyptian
درامي,اللي ما يمر يوم الا و هو جايب لنا مصيبة,Egyptian
اطفال,في موعد,Egyptian
درامي,حصلش الكلام ده استاذ خالد انا بقالي بشتغل عندكم ثلتعشر سنه شفتم مني حاجه وحشه لا سمح الله والشغاله دي بقالها بتشتغل عندكم ست سنوات انا عمري يا,Egyptian
كوميدي,والله ما انا فاهم منكن حاجة,Egyptian
درامي,النجدة يا عالم يا هو الحقونا الحقيني يا سيتي النجده الحقيني,Egyptian
درامي,و ابي الموضوع يكون منتهي فهمت,Egyptian
درامي,خلي بالك على نفسك,Egyptian
درامي,ما فيش حاجة حصلت يعني زي ما احنا ايه ده,Egyptian
درامي,ان شاء الله هتعدي هتبقي زي الفل,Egyptian
كوميدي,ايه ده مش حلاق ولا ايه الا,Egyptian
درامي,كشف المستور مش لاعبتي يمكن فم حاجة كده ولا كده هو انتي الي بتساليني يا ستي,Egyptian
كوميدي,انا برج القاهرة,Egyptian
اطفال,اولادي احبابي اطفالي بناتي اهلا بيكم اهلا اهلا اهلا بيكم اهلا اهلا في حكاية في رواية في حكاية ف,Egyptian
كوميدي,لكن دلوقتي حسيت بالغربة اكثر انا متاسف متاسف جدا من الكلام اللي بسمعه منكم,Egyptian
كوميدي,فان عزام عفوا,Egyptian
درامي,بس وغلاوة امي ما حارحمة,Egyptian
كوميدي,كيف ايه عايز ايه,Egyptian
درامي,لا بالعكس ما صار شي,Egyptian
كوميدي,تلامذتي تعال اما اعرفك عليهم,Egyptian
اطفال,يا رب,Egyptian
درامي,بسيت على رضوان عرفت انت مكسوف مني,Egyptian
درامي,بس بعد ما عرفت ان انا حامل,Egyptian
كوميدي,ماشي الصباح رباح,Egyptian
كوميدي,اتفضلي ده هو بيركن السيارة حقته تحت اتفضلي هناك نقعد اهلا اهلا وسهلا اهلا اهلا اهلا يا فندم اهلا,Egyptian
درامي,ما شاء الله وفهمت هذا كله,Egyptian
كوميدي,جيت ازاي,Egyptian
درامي,اول ما يوصل للتركيب اكون معاه,Egyptian
درامي,باذن الله,Egyptian
درامي,يا اختي افهم يعنى ايه انا في انتظارك هاهاها ياختي بتضحك على ايه دي,Egyptian
درامي,وايش عرفنا يا فاطمة,Egyptian
كوميدي,ده صاوريخ والدنيا مولعة حيثافر ازاي ده كلام فاضي دول دول مثاكين دول مثاكين بيبحثوا عن اي اه نجاح زائف ما هي واضحة,Egyptian
كوميدي,مش عارف,Egyptian
كوميدي,بالنسبة لمعظم اعمالي بتدور احدثها في احياء شعبية هاهاها حاكم انا اصلي من مواليد بولاء,Egyptian
درامي,انا مظلوم يا سعادة البية,Egyptian
درامي,ما هو ده مدير المشروع اللي كل المصايب اللي بتحصلنا ديه من وراه,Egyptian
كوميدي,خليكو معايا يا شباب انتبهوا معي للتجربة ايوه,Egyptian
درامي,لحظة,Egyptian
درامي,استرها يارب استرها يارب ربنا يرجعك بالسلامة يا سي بكر وانت يا بن فهرة,Egyptian
درامي,ماتخافي ماتخافي,Egyptian
كوميدي,اللي يثبت انه في تقارير طبية بتقول انه خوالك هم اللي ضربوكي وطلعولك ودم مش فيك ودم مش ضربوكي يارب يارب سامحني انا بكدب عليه فهمني ايوة,Egyptian
درامي,يا نهار ابيض ده الواحد ما كانش شايف اي حاجة,Egyptian
كوميدي,ده مسجل عندي متوفي يا شيخ,Egyptian
كوميدي,اييه وانتو هتنامو هنا,Egyptian
درامي,هو ليه الحلم ما بيكملش,Egyptian
درامي,اهدي اهدي اهدي يا حبيبي اهدي يا حبيبتي اهدي يا حبيبتي اهدي اهدي,Egyptian
درامي,لو جربتي اللي انا فيها فاطمة ما كان,Egyptian
كوميدي,في صيدلية هنا في اول حتة,Egyptian
كوميدي,اي مطار حد حيثافر والحرب ثغالة,Egyptian
درامي,بس ما تخبيش على صحبك,Egyptian
كوميدي,في الاول ايه,Egyptian
كوميدي,تعدد الزوجات دي حاجة جميلة خالص وراء كل رجل عظيم امراة تخيل بقا لو الرجل ده وراه اربعة,Egyptian
درامي,سجليلي هنا,Egyptian
كوميدي,الخامس والسادس اشوفهمم محلوين الحصة الجية,Egyptian
درامي,ايوة كان لازم نساند الدكتور سلطان,Egyptian
درامي,يا حامد,Egyptian
درامي,مع السلامة,Egyptian
درامي,هاهاها,Egyptian
اطفال,انا دفعت لك اكثر من ثلاث مرات يا فاضل,Egyptian
درامي,سلطان الحين ما هي بصالحنا,Egyptian
كوميدي,انا بقول يعني حيث كده بئا نجيب كوباية عصير كوباية مانجا انا عندي عرق سوس بالحبهان لو انتي عايزة,Egyptian
درامي,انا سمعت الدكتورة بتقول بلاش مهدئات,Egyptian
درامي,لا ولا حاجة,Egyptian
درامي,عشان انا بصراحة عايزة اتعالج,Egyptian
كوميدي,الخمسة بتاعة ايه انت ولا ولا انت حتشتغلنا انت الراسم عالبت ياض متشتغليش عشان ما اشتغلكش اقسم بالله وامد ايدي عليك يلا يلا مشيه من هنا دلوقتي حالا اهو عشان ممدش ايدي يلا,Egyptian
كوميدي,ابو علي هو مو بس و ابو حسين اكبر بس اه جميلة دي ابو علي هو و بس و ابو حسين اكبر بس,Egyptian
كوميدي,مرحلة متاخرة وممكن يكون سبب مشاكل في الكبد وهنا هتبقى مشكلة كبيرة,Egyptian
كوميدي,اخرص انت اللي تخرص,Egyptian
كوميدي,سدئوني انا مبسوط من حماسكم ده ومتفائل ان شاء الله ان المسلسل ده لما يتعرض حيترك اثر طيب في نفوس المشاهدين,Egyptian
اطفال,ولا اقولك روح اشتغل مع ابن خالتك في الاراضي ها,Egyptian
كوميدي,ربنا سبحانه وتعالى بيشفي صالح اسمع بس,Egyptian
درامي,ايواه محمد,Egyptian
كوميدي,لو عايز تعرض ال الاشعة دي على دكاترة ثانية معنديش مانع,Egyptian
كوميدي,اللي تشوفه,Egyptian
كوميدي,امري لله يا حسام خذ بالك من المحل انا رايح مع الراجل ده,Egyptian
كوميدي,طبعا العشر تلاف دول حق سعا صاحبة القضية,Egyptian
كوميدي,عامر بيتاع الهجولة,Egyptian
درامي,انت اللي عالم بعبدتك المسكينة تعبانة قد ايه,Egyptian
درامي,انا عندي رز و ملوخية,Egyptian
كوميدي,انشاء الله بخير انشاء الله,Egyptian
كوميدي,انا بئول لكو اهو,Egyptian
كوميدي,اهدى الزاي,Egyptian
كوميدي,دي بتاعتي يلا بتاعتي انا,Egyptian
درامي,لا حول ولا,Egyptian
كوميدي,الو ايوا انت فين في ناس مهمة هنا عندي في المكتب اه عايزينك بقولك ضروري مهمين والله طيب ماشي تفضلي تفضلي,Egyptian
درامي,يا ستي مش وقته تعرفي تفتحيها ولا لا,Egyptian
كوميدي,خالد وخالتي ام وخالد في حاجات ضروري انهم يعرفوها,Egyptian
كوميدي,اتفضل اتفضل,Egyptian
درامي,الموضوع انتهى من زمان ما حد ضرب احد على يده وقال وتعالى اشتري الناس هي اللي صابتها سرعه على الاراضي,Egyptian
كوميدي,لا لسه ما خرجناش,Egyptian
كوميدي,اهلا وسهلا استاذ محميد اهلا وسهلا اهلا وسهلا انا ا الحقيقة يعني فيه تجربة بفكر فيها بقالي كتير قوي يعني المسلسلات بتاعتنا بنصورها هنا او بنصورها في اي دولة عربية اخرى,Egyptian
كوميدي,كويس قوي,Egyptian
كوميدي,يلا سم هذي النخل اطلع لنا فوق وهات لنا منها البلح,Egyptian
درامي,في ايه انت كمان ايه اللي موترك كده,Egyptian
درامي,يا راجي قايلك مية مرة اول ما ييجي الاستاذ خالد القهوة بتاعته تكون جاهزة انت عايزه يخصم عليك انت ناقص,Egyptian
كوميدي,تعالى يا سلطان قوم,Egyptian
درامي,ومن سمعك ياستي,Egyptian
درامي,ما تخافش يا حبيبي انا عمو سلام,Egyptian
درامي,ف لما تجعل من لا يقدر هذا الحب,Egyptian
درامي,انت رايح فين,Egyptian
درامي,نعمين نعمين يا عيون نجوى,Egyptian
درامي,بالراحة حياتي بالراحة ايوه,Egyptian
درامي,انت بتعمله فيا ده,Egyptian
كوميدي,ان شاء الله نص ساعة واحنا نبقى عندكم,Egyptian
درامي,غدا سيفتقدون اليك ويطلبون رؤيتك,Egyptian
درامي,وبعدين اول لما يتم الحمل هطلقك,Egyptian
درامي,ده مريض ثاني معاك في الاوضة,Egyptian
درامي,بس من فترة قليلة جدا شوفت فيديو لام متوحشة كان بالنسبة لي انا متوحشة يعني بتضرب ابنها ضرب مبرح طب ازاي قدرت تنام بالليل وابنها بيعيط العياط دا كله فقلت ان انا لازم اتكلم في الموضوع ده عشان ما ينفعش الامهات يعاملوا ولادهم كذه ولو انت مش قد مسؤولية الامومة,Egyptian
درامي,في حل حندخل,Egyptian
درامي,كده برضه يا علي,Egyptian
درامي,بتراقب الناس اللي بيصلحوا الفيلا,Egyptian
كوميدي,المحل محلي غيرواضح ماني محلق,Egyptian
درامي,ايوا اهو ما فيش اي حاجه,Egyptian
كوميدي,عشان نشوف مين فيكو اللي بيذاكر ومين اللي قاعد يفلها ومزلق,Egyptian
درامي,من ساعة ما كلموني في التليفون ماني قادرة اتلم على نفسي,Egyptian
اطفال,لسه معلمك يا مورعي الاشكال انا اعرف اتفاهم معاها كويس تعالا ياد,Egyptian
درامي,عشان كمان شويه هبقى في اوضه العمليات,Egyptian
درامي,خلاص يا علي,Egyptian
درامي,ارادته فوق كل شيء,Egyptian
درامي,لا ليا لوحدي,Egyptian
كوميدي,عموما يا اخوان الاسئلة دي انا هرد عليها,Egyptian
اطفال,حب الارض شيء جوانا,Egyptian
كوميدي,احنا دلوقتي يعتبر خلصنا المنهج بالكامل,Egyptian
كوميدي,ماشي,Egyptian
كوميدي,مش قلتلك كل حاجة بعملها بنفسي مش معقول ده كله بيطلع في المونتاج محدش يقلق بس حبة ضمير حبة ضمير يا اخوانا دي فلوس ناس,Egyptian
كوميدي,يا جماعة الخير وينه ها المخرج شوفوه عشان ما نتاخر في التصوير شوفوه وينه,Egyptian
درامي,سلطان ذا قلب علينا الدنيا,Egyptian
كوميدي,اتفضل يا استاذ يا اهلا وسهلا يا اهلا وس,Egyptian
درامي,ارمي سلاحك ايوه زي الفل,Egyptian
درامي,لا صدقي,Egyptian
اطفال,انا برضه كمان طيار,Egyptian
درامي,الفطار يا ست نوف,Egyptian
درامي,في واحدة بتقولي اديني سلطان,Egyptian
درامي,عشان ربنا يسهلها معانا ويخرجنا منها على خير,Egyptian
درامي,يلا يلا,Egyptian
درامي,استاذ بكر استاذ بكر ن,Egyptian
درامي,وشك بقلول ليه ولا على حبيبه,Egyptian
كوميدي,عن نفسي انا بحييكوا لان هو ده الفنان,Egyptian
كوميدي,حل الحل موجود بس مش بساهل كده,Egyptian
درامي,الحمد لله,Egyptian
كوميدي,واحد متوفي والثاني حي,Egyptian
اطفال,قولي يا بابا وقول على الخير,Egyptian
درامي,يا قلبي,Egyptian
درامي,متشكرة قوي,Egyptian
درامي,اطلاقا و انتي قلتي لعقلش ما هو معقولة اني اوقع عقد بدون لا افهم ويش فيه انا نفسي اعرف انتي الكلام هذا تقولينه لمين موب انتي وقعتي مليون ورقة لوجدي بدون لا تدري وش فيها,Egyptian
اطفال,كنت بغيت الشوق الاقيكم,Egyptian
اطفال,وانا برضه كمان بحار,Egyptian
اطفال,هات,Egyptian
درامي,اي حاجة,Egyptian
درامي,بكره الصبح ان شاء الله قبل معاد العمليات حتلاقيني,Egyptian
كوميدي,مش قلتلك وجالك كلامي يلا استقبل بقى,Egyptian
كوميدي,تيجي من هناك جري تروح داخل بقى من هنا وتقولها ازيك يا طنط وتروح جاي على عمك وقوله شلونش عشان نخلص,Egyptian
درامي,انت اللي خسران,Egyptian
كوميدي,اذا الشرط عاجبك اهلا وسهلا مش عاجبك روح نقيلك مخرج تاني دول في السوق ياما على افا من يشيل لكن صدقني زي الكوماندا مش حتلاقي انا وحيد القرن,Egyptian
درامي,قالوا طرى ملكش امل في قربها لو يوم ابي,Egyptian
كوميدي,ادخل,Egyptian
درامي,وابن فهرة يحب يشرب ايش,Egyptian
كوميدي,اسمع انت وهو حقولكم كلمتين حطوهم حلقة فودانكم اوعوا حد فيكم يفكر يهرب البلد كلياتها محاصرة,Egyptian
كوميدي,ايوة,Egyptian
كوميدي,اي خدمة يا بيه,Egyptian
كوميدي,انا عاوزكم فطاحل في الفيزياء,Egyptian
درامي,غادة اوكي غاده,Egyptian
درامي,ايوه بس انا مش حسكت انا لازم اعمل فيديو عن الموضوع دا,Egyptian
درامي,تعال روح اوضتك,Egyptian
درامي,قومي بقى اعمليلنا لقمة ناكلها يعني كملي الرجولة,Egyptian
كوميدي,اييه مهو ال عندنا قانون احنا يا فندم نرجع القانون,Egyptian
درامي,فلو عايز تنام مرتاح ومن غير قلق جهزلي الفلوس ذي ها,Egyptian
كوميدي,هذا هذا صولي ها وهذا,Egyptian
درامي,الراجل ده مش مزبوط ايه الوقعة الهباب اللي انا وقعتها معاه دي,Egyptian
كوميدي,جمال اه صح,Egyptian
كوميدي,على حكاية الهندسة عايز اقولك حاجة عندنا مسلسل بدوي يعني لو شوفته هتاكل صوابعك وراه هقولك على سر بقى المسلسل ده ضارب في الخليج,Egyptian
كوميدي,ايه اه ايه انت مين انت,Egyptian
كوميدي,العاب وعظيم سعروه,Egyptian
كوميدي,دي ورطة مابعدهاث ورطة ده الجيث الغولي وقع في ثر اعماله,Egyptian
درامي,قلتله تعالى وانا شايلك,Egyptian
كوميدي,افزعله بالموية ولا بالكمادات ولا لا انا حجيب المكسرات وجيلك يخرب بيوتكو,Egyptian
درامي,بس بوكرة,Egyptian
درامي,انت المفروض تبقى في المصنع دلوقتي,Egyptian
اطفال,يا ولدي انت مش اول واحد ولا اخر واحد ابوه يعامله بالطريقة دي بس مش معنى كده انك تكره كل الناس وعاوز تنتقم منهم,Egyptian
