Category,ProcessedText,SpeakerDialect
درامي,في حسابات بيني وبين بابا بنصفيها مش كده يا يحيى,Egyptian
درامي,مطلعة عيني الثنتين,Egyptian
كوميدي,الله يخليك ان شاء الله تكون مصر عجبتكوا,Egyptian
درامي,شوف,Egyptian
كوميدي,مش قولتلك,Egyptian
كوميدي,امم القيالة,Egyptian
كوميدي,الخير كثير يا ام خالد والحمد لله,Egyptian
درامي,انا مش عارف استاذ خالد عايز ايه بالعبيط ده,Egyptian
كوميدي,بئولك كدا حقي حقي,Egyptian
درامي,بن فهرة,Egyptian
كوميدي,اه حمد عارف السكة ده حتى ما عربية خالد,Egyptian
اطفال,في موعد,Egyptian
كوميدي,ومن صديل,Egyptian
درامي,عارف انا امي ما حلتهاش غيري امير جان سايبها وانا جاينا شقيان هنا يا راضوان عشان لقمة العيش,Egyptian
درامي,ما هو انا لازم اعرف,Egyptian
درامي,لازم اختي تنام لحالها,Egyptian
درامي,حكم,Egyptian
درامي,هو بعينه,Egyptian
درامي,عليه العوض ومنه العوض عليه العوض ومنه العوض يا زينهم,Egyptian
درامي,راح من بالي اجازه,Egyptian
درامي,يختي الغلب اللي انا فيه ده واحدة قافلة عليها اوديتها وعماله تقرا قصص و روايات والتاني اللي طالع عليه اسمه اليوجا يا دي الغلب يا ربي نجوى يا ناعم يا ست,Egyptian
درامي,طيب ممكن تسكري مشان اعرف كيف بدي اتصرف,Egyptian
درامي,من وين بيجي الخير,Egyptian
درامي,بسرعه,Egyptian
درامي,ورايا عيادة وراي عيادة,Egyptian
درامي,معلش والله دكتور الموبايل كان معمول سايلنت,Egyptian
كوميدي,ائولكو تصبحو على,Egyptian
درامي,يشوفك يتغير ويهتز بدنه ويدور وجو عنك وتقولي ما في شيء بينك وبينه,Egyptian
كوميدي,معفن,Egyptian
كوميدي,التباس التباس,Egyptian
كوميدي,لكن يختي في ناس لسه جوة اللعبة وانا لازم احافظ لهم على حقوقهم,Egyptian
كوميدي,هناك به وسيبني اشوف شغلي,Egyptian
درامي,كان نفسي اجبلك الطفل اللي انت بتتمنيه,Egyptian
كوميدي,والثانية والساعة,Egyptian
درامي,هو حضرة الاستاذ سالم و اخوك الخبل,Egyptian
كوميدي,ودي اخر كلمة باقولها لك خد بالك من نفسك يا محمد كويس خد بالك من نفسك يا محمد كويس سلام عليكم اشوف وشك بخير يا محمد انا عندي حصة بسرعة سلام عليكم,Egyptian
درامي,يا وقعة طين يا عمي العود,Egyptian
كوميدي,اسمع يا حبيبي انت فاكر النجومية كده يعني بالسهولة دي,Egyptian
درامي,هل انا وجودى يدايقك,Egyptian
درامي,يعني انا جيت بحادثة سيارة,Egyptian
درامي,مجنونة يعني,Egyptian
كوميدي,انتو صدقتوا انا كنت بهزر ده ما صدقت لاقيت اهلي وحبايبي,Egyptian
كوميدي,خمسين ريال بعد كل ده,Egyptian
كوميدي,بقلك لا,Egyptian
درامي,وتخلص لي الموضوع في اسرع وقت,Egyptian
درامي,ولا انا استنجد بيه كصاحبي,Egyptian
اطفال,زي ما هي يا ابو نسمه,Egyptian
كوميدي,حاضر حاضر,Egyptian
اطفال,خلاص يا ولدي,Egyptian
كوميدي,يبقى كمين,Egyptian
درامي,تمام يا افندم حاضر,Egyptian
درامي,مشكله اسكت ده عنده بلاوي متلتله في البيت,Egyptian
درامي,مش قادرة افهم مين فيهم اللي كسر التاني,Egyptian
كوميدي,طلعلو اسد,Egyptian
درامي,انا بس حبيت اوريك ان انا اقدر اعلم عليك و ازعلك,Egyptian
درامي,هو مين ده,Egyptian
كوميدي,سرقتهم وانت مالك ومالي يا عم,Egyptian
اطفال,ساعتك,Egyptian
كوميدي,بس من غير تفكير انما عامر عافر يفكر ويفكر ويفكر غيرواضح,Egyptian
كوميدي,تمشي دلوقتي,Egyptian
درامي,ثانية وحدة بصي حضرتك انا معي التليفون,Egyptian
درامي,معايا في الاوضة,Egyptian
كوميدي,عبا عبا عبدالله عبدالله,Egyptian
درامي,دي بلدو علي,Egyptian
كوميدي,مشرف مؤقت مشرف زمانك,Egyptian
اطفال,ايوا السلام عليكم,Egyptian
كوميدي,ما تقوليش اوس خمسة,Egyptian
درامي,والله زي ما وصيتك قبل كده,Egyptian
كوميدي,طويل العمر هديك المبلغ اللي انت عايزه بس هيتصور معاك في فيديو وانت تشكره على العطايا اللي ادها لك ماشي,Egyptian
درامي,هم يقولوا بس,Egyptian
كوميدي,الو,Egyptian
كوميدي,اهلي,Egyptian
كوميدي,غيرواضح يا اهلا وسهلا,Egyptian
درامي,بس بحاول,Egyptian
درامي,بس اخر حاجة تفكر فيها هيا ضرب النار عايزين ندخل المزرعة دي ونخرج منها من غير ما نضرب ولا رصاصة فهمتني,Egyptian
درامي,ياني منك الراجل ده هيجنني,Egyptian
درامي,الحمد لله,Egyptian
درامي,ماعرفش خد بس شكلها عايزك وعرفانك و على تليفونك يا ملك يالبرمجيات حسبنا الله ونعم الوكيل,Egyptian
درامي,المشروع هيتم,Egyptian
درامي,استغفر الله العظيم يارب,Egyptian
كوميدي,الله الله الله الله انت كده يا استاذ وقعت في الغلط انت عارف مرة نجمة كبيرة وقعت في نفس الغلط اللي انت عملته ده من غير ذكر اسماء كانت سعاد حسني فقلت لاه بقا دانا الكوماندر,Egyptian
درامي,ماله ده مجرد فرد امن مش اكتر وبعدين انا عايز اعرف هو انا متهم بشيء معين ا انا عندي مئات الموظفين في الشركة بتاعتي والعمال يعني انا اكيد مش حتحمل مسؤولية تصرفاتهم الشخصية وبعدين انا لو في اي اتهام رسمي موجه ليا يا ريت تقولهولي لاني مش هتكلم غير قدام المحامي بتاعي,Egyptian
درامي,هذا اسلوب جديد,Egyptian
درامي,وزي ما تكون النتيجة انا رضية,Egyptian
كوميدي,وكنت عمدة عليكو تلاتين سنة,Egyptian
كوميدي,اه هو دا انت تعرف ابو علي و من هو صغير,Egyptian
درامي,لا اكيد العقد فيه ملعوب,Egyptian
كوميدي,في المعاد بالدقيقة,Egyptian
درامي,هنعمل ايه دلوقتي,Egyptian
اطفال,حضرة الضابط,Egyptian
كوميدي,يلا يا اخويا,Egyptian
كوميدي,اختراع عظيم,Egyptian
كوميدي,لكن للاسف مضطرا,Egyptian
درامي,يلا بينا,Egyptian
كوميدي,طبعا طبعا,Egyptian
درامي,ماشي ماشي يا عم,Egyptian
كوميدي,قولوا معايا,Egyptian
كوميدي,الدبرة دبرة ربك سيبني انا,Egyptian
اطفال,يعني ما في فايدة مافي فايدة مافي,Egyptian
كوميدي,الاكل جميل الاكل جميل الاكل ده كله,Egyptian
كوميدي,هي باختصار ا ال ال ال يلا,Egyptian
كوميدي,لا لا لا استوب الزام حدودك يا حبيبتي,Egyptian
درامي,طيب يا دكتور كنت عايز اسالك سؤال يعني معلش كده مارضيتش اسالك قدامها,Egyptian
كوميدي,سعد ده يعمل اي حاجة يكون فيها ورق تزوير حبر شيل حط الزق ده سعد اسطورة,Egyptian
كوميدي,مين اللي جاب الخيمة الزفت دي,Egyptian
كوميدي,اسمك ايه انت يا بتاع البلدية,Egyptian
درامي,فاضية,Egyptian
درامي,تربطه ايه يا عتيق انت بتتربط كمان,Egyptian
كوميدي,كدة مع الصبح يا حجام كدة مع الصبح اييه شتيمة شتيمة شتيمة,Egyptian
درامي,يا سلام و ازاي حنعرف معاد الضربة,Egyptian
درامي,في حاجة تانية يا دكتور,Egyptian
درامي,ان شاء الله هتعمليها بس هي التغيير المفاجئ ده,Egyptian
درامي,تبعد عن اي انفعال,Egyptian
درامي,اصلا فيه مثلا عندنا بيقول ايه,Egyptian
درامي,انا حسبكو بقى تشربوا اهوتكمو بستاذنكم بقى انا شكرا,Egyptian
درامي,من قلبك هذا الكلام ولا عشان زينب وموقفها منك,Egyptian
درامي,انتي وقعتي عقد وجدي,Egyptian
كوميدي,اصحو اصحو,Egyptian
كوميدي,ما شاء الله ما شاء الله سايبين الشغل وقاعدين هنا يلا قدامي قدامي هناك,Egyptian
درامي,زي ما انتي شايفة عقود بيع,Egyptian
كوميدي,عبد الله,Egyptian
درامي,انا ماليش دعوة فيكو كل ما كلم حد في البيت ده يقلي مالكيش دعوة ما لكيش دعوة طلعوني من وسطيكم انا ما بقاش ناقصة,Egyptian
كوميدي,ايه رايكم ما,Egyptian
درامي,لم مرزوق تقول بيتى قدام,Egyptian
درامي,دي فاضيه,Egyptian
كوميدي,وبعدين بقى تفيدة تاني مش قولنا توتة,Egyptian
اطفال,لا بننساه ولا يوم ينسانا,Egyptian
درامي,حط نفسك مكاني,Egyptian
كوميدي,امال شايفني قدامك بعمل اية يعني,Egyptian
درامي,مين اللي يقدر يقول معدودة والتحاليل الاشعة العلم بصفة عامة مش معقول طبعا يا ابو بكر انت ناسي اني مشيئة الله سبحانه وتعالى بيبقى لها حكم ثاني,Egyptian
اطفال,هات الشنطة,Egyptian
كوميدي,وقع الاختيار عليكوا انكوا انتوا تعملوا بعض الادوار المهمة ان شاء الله في المسلسل الجاي اللي انا هعمله ايه رايكم,Egyptian
كوميدي,تاني المحرم طيب اعملك ايه يعنياولا انتو يا البدو كلكم قاعدين في الخارجي بعدين هنا الفتحة دي اقرب عشان نختصر الوقت,Egyptian
درامي,انا بس خايفة تيجي علي لحظة,Egyptian
درامي,ان هو كان بيعمل كل ده عشان هدف نبيل,Egyptian
كوميدي,زيك ام خالد اخبارك ايه,Egyptian
كوميدي,يعني ما رح اخذ منصب المشرفة,Egyptian
درامي,انا مش طالبة منك غير الصبر,Egyptian
كوميدي,الحق الحق ابو دخيل النجمة وصلت,Egyptian
درامي,مع انا شنتايتي كانت معاهم,Egyptian
درامي,وانتا هتعوز اكثر من لي خدتو ايه يا سيدي,Egyptian
كوميدي,هنا,Egyptian
كوميدي,اه,Egyptian
كوميدي,ا,Egyptian
درامي,اولا حاجتك مش معايا,Egyptian
درامي,يا فرحتك يوم انك تضحك,Egyptian
درامي,يا غ,Egyptian
درامي,والشي الثاني والاضخم,Egyptian
كوميدي,امم كدا تصبحو على خير الحمد لله وش دي السلعوة ولا حمارة القيالة ولا حمارة القايلة دي بسم الله الرحمن الرحيم بسم الله الرحمن الرحيم عبد الله عبد الله عبد الله,Egyptian
درامي,اول شي,Egyptian
كوميدي,خلصت اللعبة احنا كنا بنصوركم بالكازينو لحد هنا نعرفكم ونشكركم احنا في الكاميرا الخفية هاهاها,Egyptian
درامي,انا ما بدي منك شي,Egyptian
درامي,مين ذه,Egyptian
درامي,انت عندي بالدنيا كلها,Egyptian
درامي,استاذ عبد العزيز عندي عايز يقابل حضرتك ايوه,Egyptian
درامي,ده مين ده,Egyptian
درامي,جايز تكون عامل عاملة كده ولا كده ومكسوف على دمك وحاطط في عنيك حصواية ملح وناوي تسمع وانت ساكت,Egyptian
درامي,اللي حصل حصل,Egyptian
درامي,ايوه يعني تاكل ايه علي,Egyptian
كوميدي,في الاول خالص حنفتح على قرية تراثية,Egyptian
درامي,اللي ما يقدرش على الحمار يتشطر على البردعة,Egyptian
درامي,ايش هذا كلام يبغيله ما عاد اسمعه منك,Egyptian
درامي,يعني ايه,Egyptian
درامي,ودلوقتي ايه اللي حيتم بعد القبض على فارس ورجالته,Egyptian
درامي,طبعا ده ما بيتعاملش مع اي شركات امن تانية بالشركة بتاعتنا,Egyptian
كوميدي,تعبان,Egyptian
درامي,شكرا دكتور سلطان,Egyptian
كوميدي,قاعد هناك يتونون يا ناس,Egyptian
كوميدي,مش فاهم,Egyptian
درامي,حركة جامده منك والله دكتور سلطان,Egyptian
درامي,شرق من غرب وانت ما تعرفش كمان الشرق من الغرب يادي الواقعة المنيلة تعالي يما شوفي الواقعة اللي انا فيها,Egyptian
كوميدي,دي حتبقى فيتنام التانية صدقني وانا عارف كل حاجة بخبرة اه وفي المجال ال ال يعني كبيرة قوي,Egyptian
درامي,ما تخافش علي يا حبيبي,Egyptian
درامي,لا يا سلام بالسهولة دي طب افرض عرفنا ندخل وخرجنا من غير ما حد ياخد باله مننا بالنسبة للكاميرات المنتشرة على سور الفيلا دي ايه,Egyptian
درامي,في ايه بقى فهميني,Egyptian
درامي,انا تحت امرك اشوف,Egyptian
كوميدي,ما عنديش مانع انا امضيلهم اللي هما عايزينه ما فيش مشكلة حمضي معك و لكن احب اقول لكم حاجة ده اتفاق نهائي واللي اوله شرط اخره نور يعني ما حدش يقدر يرجع في القرار ده,Egyptian
درامي,ده كان اول حملة للمدام صح,Egyptian
درامي,بس ارجوك,Egyptian
كوميدي,حناخدها من ميديم لونج مضروب كده ما فيش,Egyptian
درامي,استاذ باكر قولي بقى المحترم بن فهرة عاوزك ليه,Egyptian
درامي,اه مش معقول,Egyptian
درامي,شارية مصلحتك وخايفة عليك,Egyptian
درامي,انا شامه ريحة شياط في القلب يا روحي هاهاها ستي يا ستي مابقاش انا نجوة اذا ما كانش الوادي ابن فهره ده واخد من العقل حته ومن البال حتتين ومن القلب متعدي يا ستي بقوا في المحادثة,Egyptian
درامي,انا خايف عليك,Egyptian
درامي,يمكن,Egyptian
درامي,وبعدين احنا فرحانين بنجاحنا ولا قاعدين نعكر على نفسنا,Egyptian
كوميدي,سيب لي الحاجة والملفات والحسابات دي كلها,Egyptian
كوميدي,دل اللي كان نفسي فية لو تجي صدفة تجمعني بيه فرصة عمر ضيعها ليه مش معقول ويا الحياة هتحلى وانا معاها هو ده اللي بتمناه واللي عيني شيفاه احساس انو احلى واغلى الناس,Egyptian
كوميدي,بالقفر,Egyptian
كوميدي,طعمه غريب,Egyptian
كوميدي,الزبدية,Egyptian
درامي,ده ال اى بى بتاع الجهاز اللي تنقل منه الفيديو للفلاشة دي,Egyptian
اطفال,جدو سرحان وسعيد ماجو ولا اتصلوا كمان,Egyptian
درامي,ده سلطان ايواه سلطان,Egyptian
درامي,انا وصلت للمكان,Egyptian
كوميدي,طب وليه,Egyptian
درامي,الي هحكي لكو عليها بالتفصيل الفترة الجاية,Egyptian
كوميدي,واقع,Egyptian
كوميدي,ممكن العمل,Egyptian
درامي,انت رايح لبابا احمد,Egyptian
درامي,كلامك مضبوط,Egyptian
درامي,طب اعمل لك مكرونة بشاميل,Egyptian
كوميدي,هاهاها طيب,Egyptian
درامي,يعني ك كنت اشك في حالي ارجوك سامحني,Egyptian
درامي,اكره ليه صحيح بس بعلمك شي فهد,Egyptian
درامي,احنا هنستقر فيها الفترة الجايه,Egyptian
كوميدي,طب تعالوا معاي,Egyptian
درامي,يا باشا اي وقت تحب دلوقتي حالا لو عايز,Egyptian
كوميدي,يا طويل العمر اقول لك اقول لكم صدقني انت اقولك اقسم بالله,Egyptian
درامي,هي اه يان,Egyptian
درامي,مش موجودة هنا,Egyptian
درامي,اسالني عن حكايتي,Egyptian
درامي,حاجة شغلاك,Egyptian
كوميدي,غيرواضح بعدما وقع طلع له ايه,Egyptian
كوميدي,انا اتجوزت قبل ما امسك العمودية,Egyptian
كوميدي,عايز كم كيلو,Egyptian
درامي,لا يحصل حاجتك حتاخدها,Egyptian
درامي,ما هوخالى اللى باعكم هى,Egyptian
درامي,يمكن ابوش اللي خلاش تو,Egyptian
درامي,وللاسف احنا ما نعرفش عنها حاجة لكن الوحيد اللي يعرف حاليا الدكتور علي,Egyptian
كوميدي,في دي مقدرش اقول حاجة خالص,Egyptian
درامي,ولا سكت ولا حاجة,Egyptian
كوميدي,لا و ايه مش عجبها قال ايه يا ستي عايزاني ارو,Egyptian
درامي,وانت هتعملي العملية وكل لشاكين فيه ده يطلع ولا حاجة,Egyptian
درامي,منك لله,Egyptian
كوميدي,والان,Egyptian
درامي,حور اخت العقيد ناصر,Egyptian
درامي,بقول لك ايه وريني سلاحك,Egyptian
درامي,اخلع يا,Egyptian
كوميدي,حاقولك على حاجة,Egyptian
درامي,دكتور المريض اللي بيعاني من فقدان الذاكرة عمال بيدور عليكي,Egyptian
كوميدي,ايه,Egyptian
اطفال,ايه الشاي اللي انت جايبه لي ده ياد,Egyptian
كوميدي,وريحة المرحوم بابا,Egyptian
درامي,طمن قلبك,Egyptian
درامي,الله يسلمك,Egyptian
كوميدي,هنا,Egyptian
كوميدي,خذ حبيبي اهو جبت لك مية تشرب لك بق مية اهو وجبت لك الكمادات والمكسرات تكلم يا بابا قول يا حبيبي,Egyptian
كوميدي,ده من ده,Egyptian
درامي,تقدم على جاد حبيبك ها,Egyptian
كوميدي,عملت لوحدة دعاية انتخابية ايه حاجة ما حصلتش حاجة تهوس,Egyptian
كوميدي,لحظة وحدة لحظة وحدة,Egyptian
اطفال,وعليكم السلام ورحمة الله وبركاته,Egyptian
كوميدي,عايش معاكم,Egyptian
كوميدي,اه,Egyptian
درامي,ام يا بلشر برعاية الله,Egyptian
كوميدي,اوعا انت كمان,Egyptian
درامي,بعد اللي حصل مع سلطان,Egyptian
درامي,الدكتور قال خلاص هتخرجي من المستشفى بس هنرجع نحدد ميعاد تاني للعملية,Egyptian
درامي,ما هو لو كان لو كان العقد ممضي على مدة سنة ما بيهمني ولا يوغوشني ابدا,Egyptian
درامي,بصراحة يعني,Egyptian
كوميدي,الدبابتين دول يعني كان كاني انا اا شايفهم قدامي,Egyptian
كوميدي,اه,Egyptian
درامي,انا بقى سلمته بايدي لعصابه ولا,Egyptian
درامي,هنعمل ايه بقى,Egyptian
كوميدي,كملي يا ستي يا كبيرة,Egyptian
درامي,على سنة الله ورسوله,Egyptian
اطفال,صباح الخير,Egyptian
كوميدي,شغل مزيكا يبني خالد والنبي افرد وشك يا عم ما تطيرشي علي السبوبة يا خالد,Egyptian
كوميدي,العشاء جميل قوي قوي اللحمة جميلة الحمص جميل السلطات الحاجات دي نصيحة بالمطلق,Egyptian
اطفال,حاضر حاضر يا مستعد,Egyptian
درامي,هاهاها,Egyptian
درامي,ما في اخبار من العقيد ماجد,Egyptian
درامي,طبعا انت بتفرق وبعد اللي حصل دي كلها بقيت بطل في نظر العالم كله,Egyptian
كوميدي,قولوا انتوا,Egyptian
كوميدي,اترمى اقعد اقعد قال لا فرق يا دى النيلة عليك يا دى النيلة,Egyptian
كوميدي,سعد سعد سعد سعد,Egyptian
درامي,يا رب ارحمني منهم,Egyptian
درامي,دكتور عبد الرحمن اتقتل,Egyptian
درامي,لحد ما الامور تهدى,Egyptian
درامي,لا كدا ولا كدا سعادته تعبان,Egyptian
درامي,وانت كمان يا علي,Egyptian
اطفال,اني انا ام الخير,Egyptian
درامي,لقيت ان انا لازم اتكلم في حاجة مهمة جدا جدا,Egyptian
كوميدي,انا يانا هي يا هي انا,Egyptian
كوميدي,ماشي القضية خسرانة خسرانة احنا فاهمين دة من زمان انما انت خسران لا طبعا,Egyptian
كوميدي,يا راجل في احد بي يصدق انه في دواء اسمه خمسة واس اثنين,Egyptian
كوميدي,ثاعتها هياكل علقة من قفاه,Egyptian
درامي,افرح والا ازعل,Egyptian
درامي,غيرواضح انزل لك كمان,Egyptian
كوميدي,هتتعلموا طبعا,Egyptian
كوميدي,انظر الى زملائك,Egyptian
درامي,خليها على الله,Egyptian
كوميدي,اشغي اشغي يا ولا اشغد قبل ما الم عليك الخلق,Egyptian
كوميدي,لا حول ولا قوة الا بالله,Egyptian
اطفال,لا يا ولدي,Egyptian
درامي,هنوصله ان شاء الله ما تقلقش معاك جاد لفيتها بلاد يا نهار اسود الاجهزة بسرعة افصل كل حاجة,Egyptian
اطفال,اصحاب سرقة الراحة الابدية باختطاف جدو سرحان وسعيد,Egyptian
كوميدي,للعملية كبرت اوي ودخلت في سكك ظلم لا احنا ملناش في المشاكل دي بقولك ايه يامه احنا نمشي ونسيب الناس دول في حالهم,Egyptian
اطفال,معلش يا ولدي جرب مرة واثنين وثلاثة واربعة,Egyptian
اطفال,انا سمورة واكلي لزيز,Egyptian
درامي,انت حر,Egyptian
درامي,مو بلازم تعرفه,Egyptian
درامي,استنى لحد ما يستريح شوي,Egyptian
درامي,مكان بعيد ومنعزل,Egyptian
درامي,وانت مالك واحدة وحرة ببيتها انت مالك فيها,Egyptian
درامي,قال لي روحي ن نادي لابن فهره قوام,Egyptian
كوميدي,والحارة اللي احنا فيها ديت اعتقد اسمها مسعال مش كده برضه,Egyptian
كوميدي,انشاء الله بعد ساعة بغذن الله تاخذونه معاكم و تروحوا البيت,Egyptian
اطفال,حاضر اهاهاهاها,Egyptian
درامي,لا بص خلينا عندي في البيت احسن عشان لو هنشتغل نشتغل على اللاب توب وكمان شبكة التقوية,Egyptian
درامي,حقيقة,Egyptian
كوميدي,عمل وطني مفيش استعراض مش عايزين عادل امام,Egyptian
كوميدي,وفي احزانهم وفي كل حتة نشاركهم وبكده هيشيلوك من على الارض شيل,Egyptian
درامي,ااه اخ ياني منك روح روح منك لله يا شيخ اتفضل ادخل جوة يا موهوم يا ملعون في ناسك اتفضل ادخل جوه,Egyptian
كوميدي,ريحت,Egyptian
كوميدي,انتوا هتتكلموا باللهجة المصرية,Egyptian
كوميدي,مات ازاي هو من الي مات يا اخي ان شاء الله انت يا اخي غيرواضح,Egyptian
درامي,والله العظيم انا ما فارق معايا اي حاجة في الدنيا غيرك انتي,Egyptian
درامي,حوش البركان حوش حوش الفيضان حوش,Egyptian
كوميدي,اوو,Egyptian
كوميدي,نعم يا خوي,Egyptian
اطفال,ماني عارف يا بويا ربنا يستر,Egyptian
كوميدي,يعني مثلا عندكم الاستاذ يوسف اخويا في الست اشهر اللي فاتت فقط ساحب مليون ريال تحت بند حساب يوسف الشخصي قولي انت بقى ده بر هاللعبة ولا جواها ياسي يوسف دي حاجة الحاجة التانية,Egyptian
درامي,مش خايفة على نفسي,Egyptian
اطفال,وبكيل,Egyptian
كوميدي,قلت له يا بني انت مشروع نجم,Egyptian
