Category,ProcessedText,SpeakerDialect
درامي,هي قالت لي بلسانها انه انا فتشتها,Egyptian
كوميدي,ام ماشي,Egyptian
اطفال,مستحيل كيف حدث هذا,Egyptian
كوميدي,البضاعة دي قيمته ربع مليون جنيه يعني لو دبحتكم انتوا التلاتة وقطعتوكم عملتكم لحمة وعملت منكم مفروم مش حجيبوا ربع القيمة حتى بالهدوم اللي انتوا لابسنها,Egyptian
كوميدي,اسال عمرالشريف قعد اد ايه في الجبال فهم فانت تروح تقعد في الجبل لغاية ما تبقى نجم انا هعملك فيلم اسمه بطل الجبل,Egyptian
اطفال,ما قلتلك ناسبه انا قلتلك اشتغل معاه يعني شوف ايش يسوي واعمل زيه وبعد كدة انت تروحين لحالك وهو يروح لحاله,Egyptian
درامي,اطمني يا حبيبتي,Egyptian
كوميدي,يلا خلوه اطلعوا برا بس انتظرونا شوية ان شاء الله ان شاء الله,Egyptian
كوميدي,ايه رايكو بقى ما ما تيجو نلعب كعابة و واذا طلعت ع الخط انا ما عنديش مانع ها,Egyptian
كوميدي,والله لو تطلبيني قوات الامن الخاصة,Egyptian
كوميدي,اخ يا نهار اسود,Egyptian
درامي,اه فزت بالجنه,Egyptian
درامي,وان مهما الانسان اوتي من العلم مايقدرش يحسبها بالمزبوط ابدا,Egyptian
درامي,دى فيديو لوحدة مريضة بتضرب ابنها بشكل بشع قال ايه عشان ابوه طلقها لا وبتصور الولد وهي بتضربه هي في قلبها ايه ازي تقدر تعمل كده,Egyptian
درامي,مرسي يا حبيبتي,Egyptian
درامي,باقولك ايه يا دكتور سلطان,Egyptian
درامي,فعلا الجو برد قوي,Egyptian
كوميدي,يعني مش هنلعب يعني مش هنلعب كعابة,Egyptian
كوميدي,سامع حقي يعني,Egyptian
كوميدي,بس يخرب بيتك,Egyptian
كوميدي,بانتظاركوا اوعوا تنسوا,Egyptian
كوميدي,زي ما قالتلك ماما الخير كتير الحمد لله يعني حاجات بسيطة كده خمس قرى سياحية في اسكندرية,Egyptian
درامي,انتي فتحت الاكاونت بتاعك على الابليكشن دا تاني,Egyptian
كوميدي,ما قدرتش لكن لاقيت انه افضل,Egyptian
اطفال,ولا كلمة انتي حتردي عليا ولا ايه هس,Egyptian
درامي,مسافة ما تقفل هتلاقي عندك اللوكيشن,Egyptian
كوميدي,ان شاء الله بس خلوه شوي يرتاح الان وان شاء الله بعد تاخذونه معاكم,Egyptian
كوميدي,احنا موافقين ايس اس اس الناس اللي منورنا حبايب البي اهل العريس اهل العروسة الناس الكومة للي منورنا اقدم لكم لمعة الاحساس لمعة الشجن والطرب العاطفي المطرب خالد حركة,Egyptian
اطفال,معلمك يا مرعي قول للواد اللي على المطبخ يشوف شغله كويس لحسن اكل خشمه,Egyptian
درامي,عرف اني خدتك من شغلك كمان,Egyptian
درامي,اسمع يا سلطان,Egyptian
كوميدي,يعني ما فيش في العالم كله الا عامر ادرسه عامر,Egyptian
اطفال,حمدان حمدان,Egyptian
كوميدي,اه بتعتي انا,Egyptian
كوميدي,كثر الله من امثالك تمام,Egyptian
كوميدي,اللي اقصد اقوله انه ما فيش داعي للورق بينا,Egyptian
درامي,عملت كده يا مفتريه,Egyptian
درامي,الكلب الحقير,Egyptian
كوميدي,ايوة,Egyptian
درامي,سلطان انا حاسس حالي بالسعودية هون ضايع,Egyptian
درامي,انا حاسس اني حاستفيد منه كوييس,Egyptian
درامي,تصدق يا فهد,Egyptian
درامي,وش اكثر حاجة,Egyptian
درامي,طيب واصحابي شلون بعزمهم,Egyptian
درامي,انا واثق فيك,Egyptian
كوميدي,اذا مش حرام عليك,Egyptian
درامي,راح يتم التحفظ عليهم واتخاذ الاجراءات اللازمة معاهم,Egyptian
درامي,الحالة دلوقتي مستقرة,Egyptian
اطفال,بيع البضاعة واكسب فلوس كتير,Egyptian
درامي,يا ساتر عليكي لما بتضربي بوز بتبقى شبه واحد صاحبي,Egyptian
كوميدي,انا الكومانده انا زورنبيح الارندلي ما حدش بيضحك عليا اللوكيشن كله ينزبط,Egyptian
كوميدي,ه الله يسهلوا يا عم ه امال ايه زنابته,Egyptian
درامي,شفت الاخبار بتقول ايه,Egyptian
درامي,ما اعرفش حاجة,Egyptian
كوميدي,بتعرفوا تبلحوا,Egyptian
كوميدي,يبقى فعلا عمل محلي,Egyptian
كوميدي,عايزكم تعرفوني كام راس المال بالكامل اللي موجود هنا عشان في حاجة في دماغي,Egyptian
كوميدي,سلام عليكم,Egyptian
درامي,بتبص ليه,Egyptian
كوميدي,لازم واحد يكون منكم,Egyptian
درامي,بعد اذنك سبني امشي عايز امشي وانت مالكش دعوة بيه خلاص,Egyptian
كوميدي,عمى في عينك,Egyptian
اطفال,عشان كده بتعاقبهم,Egyptian
كوميدي,ويبدو اه انه مش الحاحه لوحده بس اللي هو عايزني ابيع له,Egyptian
كوميدي,على العموم حكم عقلك كويس اوي يا محمد وحكم ضميرك ويشوف خلي فلوسك حلال الفلوس اللي انت بتاخدها دي تكون حلال سيبك من الكلام اللي بتعمله ده وان التفت لمصلحتنا ومصلحة الولاد اللي معانا دول دول امانة في امانتنا وحنتسئل عليهم وفي نفس الوقت احنا بنرفع سمعة بلدنا في الخارج يا محمد,Egyptian
كوميدي,بصراحة انا اكلت فيها اكل,Egyptian
كوميدي,عاوز ايه ابو براهيم,Egyptian
كوميدي,بس حياة جميلة بسيطة تحمل كل معاني الجمال والبساطة انا وانا صغير كان والدي ياخدني يوديني جنينة الحيوانات ايه ايه نتمشى على كورنيش النيل نركب مركب نئزئز لب ناكل ترمس لكن بصراحة انا بحسدكم على حياتكم البسيطة دي وجمالها,Egyptian
درامي,ربنا يخليكي لي يا حبيبتي دا عشم فيكي برضه,Egyptian
كوميدي,ما تيجو نلعب كعب,Egyptian
درامي,تشتغل كيف,Egyptian
درامي,والله مش فاكر,Egyptian
كوميدي,فعلا,Egyptian
كوميدي,انا اتكلم في الموضوع,Egyptian
كوميدي,ما لقيناش في شقتكم غير ست الاف ميتين واربعين جنيه وباقي عليكم ميتين تلاتة واربعين الف سبعمية وستين جنيه جنيه ينطح جنيه,Egyptian
درامي,عين وصابيتنا,Egyptian
كوميدي,يا ريت خالتي ام خالد تتكرم علي,Egyptian
درامي,بركة يا حبيبي انك رجعت بالسلامة تعال,Egyptian
درامي,خد عندك المحامي للوطن استربع تلت ساعات متواصلة,Egyptian
كوميدي,والكعابة دي بئي ايه,Egyptian
درامي,كده برضه يا حبيبة كلمتي ماما وحكيتلها عن اللي حصل,Egyptian
كوميدي,ايوه ومسالة ال اللغة واللهجات دي حا مسالئل بسيطة قوي وهنبتدي نتكلم فيها بالتفصيل واحدة واحدة هنجيب لكوا مدرسين زي برضو لو حد من عندنا راح اي دولة عربية لو حد من مصر وطلع راح دولة عربية,Egyptian
درامي,يلا اسرع,Egyptian
درامي,اسفة ان انا تاخرت عليكم,Egyptian
كوميدي,مانمتش امبارح ما جاليش نوم,Egyptian
درامي,استنى جربت معاه ستين وصفة اللي ما يتسماش ده ملف ما نفعش شيطان ما نفعش اراجوز ما نفعش,Egyptian
كوميدي,الكعابة,Egyptian
اطفال,حمدان راح يا رب,Egyptian
درامي,وين السيارة اللي بتودينا المدرسة,Egyptian
كوميدي,جرى ايه يا بابا انت لسه ما عرفتنيش لا تعرف شري ولا تعرف خيري عشان تقولي شر,Egyptian
كوميدي,ايوه ايوه عندنا بنسميها الاولى او الحجلة ايه,Egyptian
اطفال,يا اما تسمع كلامي,Egyptian
درامي,على فكرة انا مش بعيط,Egyptian
كوميدي,اهوه اهوه وصل,Egyptian
درامي,لكن انا عارف مين معاي,Egyptian
درامي,ازي الصحة,Egyptian
درامي,المهم المبلغ ده يكون عندي اقول لك,Egyptian
درامي,تفضل يا خالد بيه,Egyptian
كوميدي,حاولت اننا الاقي ولو خط بسيط اقدر ابتدي بيه مسلسل,Egyptian
كوميدي,نعم يا روح امك تدبرولي المبلغ لعلمك شنطكم و وحاجتكو و بسبورتاكو حتكون عندي هنا بكرة الصبح ايه بكرة الصبح لو لقيت فيها فلوس تكفي يبقى انكتبلكم عمر جديد اما ازا ما لقيت شيء يبقى خليكو تندموا على اليوم اللي عرفته نفسكم فيه,Egyptian
اطفال,في امجاده ويبقى مصيره دايما ليكم اهلا بيكم واجب الفرد نحو بلاده انه يعيش يبني امجاده ويبقى مصيره دايما ليكم اهلا بيكم اهلا بيكم,Egyptian
كوميدي,لحظة وحدة ئلت حمار ايه,Egyptian
اطفال,ماني اكل,Egyptian
درامي,اخوك كان بيحب السعودية ونسها,Egyptian
كوميدي,نص ساعة كيف يا بني,Egyptian
درامي,سارة حبيبتي,Egyptian
درامي,تلاقي الدكتور عايزك في حاجة تانية,Egyptian
اطفال,اهلا اهلا اهلا بيكم,Egyptian
درامي,دلوقتي لازم نفكر بعقلنا,Egyptian
درامي,وانا مش كل ما اروح في حتة بلقيك طالعلي من تحت الارض يعني انا غبي مثلا عشان اعمل كده مش حاعمل كده يا عم اقعد بقى اقعد بقى,Egyptian
كوميدي,ايه ايه لو حد غيرك طبعا مش حضرتك يا فندم هاهاها انت عارف كلام حضرتك ده بيفكرني عام الواحد وستين في مطرب اتغر علينا في حفلة نطيت المطار شقطلي واحد,Egyptian
كوميدي,هذا ما يصير ابد وجوب نلقى حل وانا اخوتش,Egyptian
درامي,ها امي ذي لو جرالها حاجة,Egyptian
كوميدي,يا راجل يا راجل دا مصلح باين عليه جدي جدا واخذ بالك والمسلسل حاجة مش بسيطة وانت عارف المؤلف بتاعكو ده والله اللغة في حتة وهو في حتة تانيه من جنبها يعني,Egyptian
درامي,ابنك برا اللعبه,Egyptian
درامي,احنا ما احنا ساكتين الله يحفظك قاعدين نسوي اللي علينا,Egyptian
كوميدي,وبكده,Egyptian
درامي,في ايه,Egyptian
كوميدي,ما تقوليش اوس خمسة بص,Egyptian
درامي,اقول انا يا سيدي اقول انا يا سيدي,Egyptian
درامي,مش عارفة,Egyptian
درامي,في ايدينا ايه نعمله,Egyptian
درامي,استاذ خالد عايزك,Egyptian
كوميدي,لا اكلت حق حد ولا ظلمت حد,Egyptian
كوميدي,لو كانوا بقى عايزيننا هم اللي دوروا علينا,Egyptian
درامي,حالتها صعبة قوي,Egyptian
درامي,بالنسبة للحمل,Egyptian
درامي,والحل ايه يا نجوى والحل ايه,Egyptian
كوميدي,محبوكة ومعمولة واضحة,Egyptian
اطفال,والله انت ابن حلال يا حضرة الضابط انا ليسا كنت راح اكلمك ايوا يا حضرة الضابط,Egyptian
اطفال,والاربعه و عشرين ساعة عدو,Egyptian
كوميدي,رئيس العصابة خود المفاجاة دي,Egyptian
كوميدي,الهرم الرابع بئا اسمه خوخو ها الهرم الرابع ما انا شفته على ولا مين,Egyptian
كوميدي,انا اللي حامل دور ضاري والنجمة معانا,Egyptian
كوميدي,وانا كان نفسي اعدم كم في عمل مشرف,Egyptian
درامي,مو اكبر عين كلها,Egyptian
درامي,تحبها يابني عيونك فضحاك,Egyptian
درامي,انا لازم امشي دلوقتي عشان عندي كم مشوار مع باشمهندس عدنان,Egyptian
درامي,مع السلامة,Egyptian
درامي,عملوا الي انتوا عايزينوا,Egyptian
درامي,شكرا دكتورة شكرا كتر خيرك,Egyptian
كوميدي,المقرصة الحامية ايوه,Egyptian
كوميدي,هو انا بالمناسبة ح حنام فين,Egyptian
درامي,يحل وسطك يا بعيد اومال احنا جايبينك ليه,Egyptian
درامي,بعد ما كنا ماشين جمب الحيط,Egyptian
درامي,انت بتكلم مين,Egyptian
درامي,اعمل اي لو سلطان بقى رئيس مجلس الادارة و بكرة ولا بعده نصب على لمار وكوش على كل حاجة فجاة لقيت نفسك خط صابونة وطلعت من المولد بلا حمص ام بتعمل ايه بسيطة,Egyptian
كوميدي,حددي انتي,Egyptian
كوميدي,هو ده فهد بلام مكانش عايز يعمل الحركة دي تاعت المروحة المنديل قولتله بص انا الكومانده تعملها وعملها وهكزا كان,Egyptian
درامي,عايز تفكر معايا,Egyptian
كوميدي,مع السلامة يا سي مرسي مع السلامة يا حبيبي,Egyptian
كوميدي,لا يا استاذ ما تخافش ما تخافش حنبدا بقوة ان شاء الله هجوم على طول يا استاذ الدفاع والوسط كله هجوم يا استاذ تصدق انا عامل لك جدول ميخرش المية يا استاذ,Egyptian
درامي,ايه الشحططة الي بقينا فيها دي,Egyptian
درامي,هاخد بس عينة الدم واول ما حاله تستقر هنعمل عملية على طول,Egyptian
كوميدي,انتو احساسكم حلو,Egyptian
درامي,تفضلي,Egyptian
اطفال,يا رب يا رب الطف بيها يا رب يا رب يا رحمن يارحيم على البخت اللي راح نوحي يا حتى ظهرك حتى ظهرك يا اختي صرحوا,Egyptian
كوميدي,متعرفوش الواد تاخذوا الحاجة منه ليه وبعدين شفتوا الحاجة لكن انتوا مش بتاعتكم سبوها وامشوا ترموها في الميه ليه,Egyptian
كوميدي,ابو حسين,Egyptian
كوميدي,طلع الاسد قطع الرجل,Egyptian
كوميدي,وعليكم السلام ورحمة الله وبركاته يا اهلا وسهلا,Egyptian
درامي,طب وربنا لانت مفهمني يعني ايه محامي وطن,Egyptian
كوميدي,مبروك توضيب ماحصلش,Egyptian
كوميدي,لا والله ما اخذ بالي,Egyptian
كوميدي,اتفضل,Egyptian
اطفال,يا اما انت من طريق وانا من طريق,Egyptian
كوميدي,وهو يا حليم,Egyptian
اطفال,حب الارض من جوانا لا بننسى ولا يوم ينسانا حب الارض شيء جوانا لا بننسى ولا يوم ينسانا عايش فييا وعايش فيكم عايش فييا و عايش فيكم,Egyptian
درامي,انا اخذت عنوانك بالتفصيل من المدرسة سلام,Egyptian
درامي,كاشفاك وفضحاك في العائله,Egyptian
كوميدي,دي معلومة جديدة جدا بالنسبالي انا وانا جاي ئلت لمراتي اني جاي اكتب مسلسل بدوي,Egyptian
اطفال,صراحة ما ابغى اشم ريحة الزفر,Egyptian
كوميدي,جمع جربوع دي,Egyptian
درامي,هنرجع الرياض,Egyptian
اطفال,ويشيل عنك,Egyptian
كوميدي,بصراحة بقى يا حبيبي انا فرحت قوي انه هم مرشحينك كوزير,Egyptian
كوميدي,ومنكم,Egyptian
كوميدي,انا الي جابني هنا,Egyptian
كوميدي,ممكن نشرب قهوة مع بعض,Egyptian
درامي,طيب انا هروح معاه البيت,Egyptian
درامي,الا ما فيش حتى التلفزيون زي كاننا قاعدين في صحرة,Egyptian
درامي,واقع فى ورطة,Egyptian
درامي,وانا من الصبح بقول الدكتورة ذي بتكلم مين فاكرها بتكلم نفسها هاهاها,Egyptian
اطفال,ايه ياد ايه في ايه,Egyptian
كوميدي,وانا انام تحت,Egyptian
كوميدي,اقولك,Egyptian
كوميدي,اي خدمة يا بيه,Egyptian
درامي,سلاح لك وسلطان,Egyptian
اطفال,حسين يا ولدي يا ولدي اصحى الظهر حيبدا هم اصحى يا ولدي,Egyptian
درامي,بلاش كده يا دكتور عشان تتاسفلي ولا عشان احسسك بالذنب يا سيدي,Egyptian
درامي,موضوع الدكتور سلطان,Egyptian
كوميدي,ولا كلمة ولا حركة يا فيصل المطمطة,Egyptian
درامي,ايوه حنقوم باشر,Egyptian
درامي,انتو ماتسمعوش الكلام يلا قلتلك اكيد مش هي دي حركة بتحصل,Egyptian
كوميدي,وانا مش حلعب الا ازا اخدته ايه رايك بئى,Egyptian
كوميدي,ولا ابوي الله يرحمه اللي اخدت منه العمودية,Egyptian
درامي,اللي يخليهم يوصلوا المكان الدكتور عبد الرحمن سهل يوصلولنا,Egyptian
كوميدي,هاهاها سمعتني ده كتير اوي حاسب الشماخ ايه ده لتحرق ال المجلح يا ابني خلاص ايوه في ايه الله يحيي يا جماعة الربع,Egyptian
درامي,اخرج انت منها و هي تبقى بخير,Egyptian
درامي,هذا ما يراودك,Egyptian
كوميدي,ما عنديش مشكلة,Egyptian
درامي,عارفة انها فلتك بس الكلام هذا ماله لزوم,Egyptian
كوميدي,و اخويا خالد نصيبهم في الاملاك و الكاش اللي موجود في مصر يضاف اليه نصيب اخويا يوسف اللي اتنازل عنه ونصيب اختي ريناد اللي ايضا تنازلت عنه,Egyptian
كوميدي,عيب الكلام ده يا ابو دخيل انت عارف لو حد غيرك قال الكلام ده كان الضرب هيبقى للركب,Egyptian
كوميدي,ايوه خلاص خلاص يلا مع السلامة,Egyptian
كوميدي,من غير ما تناقشنا في موضوع اليوم,Egyptian
كوميدي,حمار القايلة,Egyptian
درامي,طب ما تحاول تنساها,Egyptian
درامي,عارفة اني بقالي كتير او ما طلعتلكوش لايف,Egyptian
درامي,مين المحامي,Egyptian
درامي,في حد هنا يهم,Egyptian
درامي,تعلمونا في بلدنا,Egyptian
درامي,الكلام ده في الكتاب اللي عندك يا ست نوف انما اللي في الدنيا حاجة تانية خالص,Egyptian
كوميدي,وتقبل مني عمارة العليا هدية مني ليها,Egyptian
كوميدي,هو المنافس بتاعك اسمه ايه,Egyptian
درامي,انا مش عارف افكر ولا عارف اخد اي قرار في اي حاجة,Egyptian
درامي,دورت على سالم في جدة القديمة كلها,Egyptian
درامي,بس خليني اهرب من هون وان شاء الله مخنوق خليني اهرب من هون من غير ما حد من الادارة يحس ممكن,Egyptian
درامي,وانت كمان,Egyptian
كوميدي,ايه خمس الاف ريال والمبلغ الضخم ده عشان حاجة يعني فيها سياسة لمو اخذه,Egyptian
كوميدي,انت عايز لك نص يوم بحاله حتى لو كنت رايح بركوبة,Egyptian
كوميدي,الم المقرصة,Egyptian
كوميدي,لا لا والله ابدا بالعكس دا القعدة معاكم ظريفة بس زي ما تئول كدا الاكلة الي الواحد كلها جامدة شوية ال هو البرقوق دا وال اييه وال اللحمة الجامدة المئلية,Egyptian
درامي,انا اللي جوايا مكتوم,Egyptian
كوميدي,طيب يبئى حقي,Egyptian
كوميدي,اهلا وسهلا,Egyptian
درامي,تشتغل,Egyptian
درامي,الو ايوه استاذ خالد,Egyptian
درامي,موضوع يا شريكي هذا,Egyptian
كوميدي,ايه رايك نعيد تاني ونعمل منظار ونعمل تحاليل جديدة ونشوفه على اساسها نقرر اذا كنا هنتدخل جراحيا و الا لا,Egyptian
درامي,على فكرة انت مش عاجبني اليومين دول خالص,Egyptian
كوميدي,انا زورنبيح الارندلي انا الكوماندا تشتغل يعني تشتغل واشتغلت وبقت واضحه,Egyptian
درامي,هو فيه ايه بالظبط,Egyptian
درامي,يا ابني رد,Egyptian
كوميدي,اللهم صلى على النبي لا فعلا طعمها حلو اوي اوي,Egyptian
درامي,انا حسيت انه اي طريق طويل ليه نهاية,Egyptian
كوميدي,تعبان,Egyptian
درامي,عشان انا صبرت صبرت يا علي والله,Egyptian
درامي,فلماذا لا تجعل هذا الحب,Egyptian
درامي,ياه انت كده تبقى قالق نفسك وقلقنا معاك يا ابو بكر,Egyptian
درامي,الواجب اللي انا بقى عملته معاه,Egyptian
درامي,تطلع باي حاجة تقدر عليها ومن اي حد,Egyptian
درامي,ما فيش حاجة بقت مضمونة,Egyptian
كوميدي,ايه قفر,Egyptian
درامي,ده كلام مش صحيح بان الشركة بتاعتنا ما بتوفرشي سكن للموظفين اللي فيها الشركة بتاعتنا ما بتتحملشي مسؤولية حاجات زي دي,Egyptian
درامي,الحمد لله قدرنا نوقف النزيف,Egyptian
كوميدي,معايا كله,Egyptian
اطفال,انا لازم اروح البيت عشان اقتل البقرة ام الخير,Egyptian
درامي,لا مش موجود,Egyptian
درامي,كان العادي يجدد له سنة اشمعنى الان ثلاث سنين اشمعنى,Egyptian
درامي,في ايه يا احلام فهميني جايبني على ملا وشي كده ليه,Egyptian
درامي,صدقي اي حاجة بتحصل,Egyptian
اطفال,هذا هو الكلام الصحيح,Egyptian
كوميدي,طبعا مشوني انا بس ايه حافظت على كرامتي بعد كده عملوا المسلسل,Egyptian
درامي,انت بس حتوحشني قوي,Egyptian
درامي,مش فاهم حضرتك عايز تقول ايه,Egyptian
كوميدي,نو به,Egyptian
درامي,طب خود,Egyptian
درامي,هدي بالك ترى,Egyptian
كوميدي,اهلا وثهلا,Egyptian
درامي,فيديوهات,Egyptian
اطفال,تعالا خوذ الشاي ده,Egyptian
كوميدي,ايه يا فندم يعني بدري الميكياتو لسا بعدين حيجي دلوقتي حالا,Egyptian
كوميدي,حلو انت تتعبش في في ملفاته وتشوف لك حاجة الناس ما تعرفهاش اي فضيحة كانت و تنزعها,Egyptian
كوميدي,اه,Egyptian
كوميدي,انا صاحب شركة انتاج درامي وبعمل مسلسلات كبيرة قوي وفيها كل نجوم البلد كل النجوم اللي انتوا بتشوفوهم على الشاشة ام حاليا بنعمل مسلسل دلوقتي وانتوا سمعتوني بكلم الاستاذ يوسف شعبان وباذن الله بنحضر مسلسل جديد برضو هيبقى فيه كل نجوم البلد,Egyptian
كوميدي,ايوة ما هي سبعة ايام طبعا فيها هئ هئ وكركر ومئ طبعا,Egyptian
درامي,تذكرة سينما,Egyptian
درامي,حصل ايه انا لازم اروح اشوف ايه الحكايه,Egyptian
درامي,اكلمك في ايه وترد علي في ايه بقولك ايش بينك وبين ابويا يخليه يعمل كده,Egyptian
درامي,اهم شيء انك مبسوط انك ما تعبت,Egyptian
كوميدي,من عنيا الجوز قشطة يا لوز,Egyptian
درامي,هي دي وصيتي ليك,Egyptian
كوميدي,الايميل ده ما يعرفش يسوق التوكتوك هنبعتلهم ايميل ده جاهل,Egyptian
كوميدي,مين اللي سمحلك تدخل هنا اساسا غلط وبعدين اتفضل اطلع برة معايا مكالمة دولية لو سمحت,Egyptian
اطفال,يوم عظيم,Egyptian
